{
  "schemaVersion": 1,
  "generatedAtUtc": "2026-09-27T12:01:58Z",
  "provider": {
    "id": "polymarket",
    "name": "Polymarket",
    "marketEndpoint": "https://gamma-api.polymarket.com/markets",
    "documentationUrl": "https://docs.polymarket.com/market-data/overview",
    "geoblockUrl": "https://docs.polymarket.com/api-reference/geoblock",
    "readOnly": true,
    "jurisdictionNote": "Australia is close-only for order placement. This project consumes public market data only and contains no wallet, authentication or order code."
  },
  "collection": {
    "status": "current",
    "rawMarketCount": 998,
    "selectedMarketCount": 48,
    "lastSuccessfulAt": "2026-09-27T12:01:58Z",
    "error": null
  },
  "categories": [
    {
      "id": "monetary-policy",
      "name": "Monetary Policy & Macro",
      "count": 12
    },
    {
      "id": "trade-industrial-policy",
      "name": "Trade & Industrial Policy",
      "count": 0
    },
    {
      "id": "geopolitics-security",
      "name": "Geopolitics & Security",
      "count": 12
    },
    {
      "id": "energy-commodities",
      "name": "Energy & Commodities",
      "count": 5
    },
    {
      "id": "technology-ai",
      "name": "Technology & AI",
      "count": 3
    },
    {
      "id": "us-policy-elections",
      "name": "US Policy & Elections",
      "count": 16
    }
  ],
  "markets": [
    {
      "id": "2589810",
      "slug": "will-the-fed-decrease-interest-rates-by-50-bps-after-the-october-2026-meeting-20260617190324029",
      "question": "Will the Fed decrease interest rates by 50+ bps after the October 2026 meeting?",
      "eventTitle": "Fed Decision in October?",
      "categoryId": "monetary-policy",
      "category": "Monetary Policy & Macro",
      "probability": 0.0025,
      "probabilityPercent": 0.25,
      "probabilitySource": "bid-ask midpoint",
      "change24hPoints": null,
      "change7dPoints": -0.1,
      "bestBid": 0.002,
      "bestAsk": 0.003,
      "spread": 0.001,
      "liquidity": 638987.92,
      "volume24h": 157405.42,
      "volumeTotal": 2259929.24,
      "openInterest": 2682365.95,
      "qualityScore": 97,
      "qualityGrade": "A",
      "qualityReasons": [
        "Liquidity $638,988",
        "24h volume $157,405",
        "Spread 0.10 points",
        "Resolution source supplied"
      ],
      "relevanceScore": 5,
      "assets": [
        "gold",
        "rates",
        "semiconductors",
        "silver",
        "us-dollar"
      ],
      "resolutionSource": "https://www.federalreserve.gov/monetarypolicy/fomccalendars.htm",
      "description": "The FED interest rates are defined in this market by the upper bound of the target federal funds range. The decisions on the target federal funds range are made by the Federal Open Market Committee (FOMC) meetings.\n\nThis market will resolve to the amount of basis points the upper bound of the target federal funds rate is changed by versus the level it was prior to the Federal Reserve's October 2026 meeting.\n\nIf the target federal funds rate is changed to a level not expressed in the displayed options, the change will be rounded up to the nearest 25 and will resolve to the relevant bracket. (e.g. if there's a cut/increase of 12.5 bps it will be considered to be 25 bps)\n\nThe resolution source for this market is the FOMC’s statement after its meeting scheduled for October 27-28, 2026 according to the official calendar: https://www.federalreserve.gov/monetarypolicy/fomccalendars.htm.\n\nThe level and change of the target federal funds rate is also published at the official website of the Federal Reserve at https://www.federalreserve.gov/monetarypolicy/openmarket.htm.\n\nThis market may resolve as soon as the FOMC’s statement for their October meeting with relevant data is issued. If no statement is released by the end date of the next scheduled meeting, this market will resolve to the \"No change\" bracket.",
      "endDate": "2026-10-29T03:59:00Z",
      "updatedAt": "2026-09-27T12:00:49.060314Z",
      "collectedAt": "2026-09-27T12:01:58Z",
      "sourceUrl": "https://polymarket.com/event/fed-decision-in-october-20260617190323537",
      "restricted": true,
      "acceptingOrders": true,
      "readOnly": true,
      "history": [
        {
          "date": "2026-09-26",
          "observedAt": "2026-09-26T21:10:17Z",
          "probability": 0.0025
        },
        {
          "date": "2026-09-27",
          "observedAt": "2026-09-27T12:01:58Z",
          "probability": 0.0025
        }
      ],
      "status": "current"
    },
    {
      "id": "2774057",
      "slug": "strait-of-hormuz-traffic-returns-to-normal-by-september-30-20260702154339440",
      "question": "Strait of Hormuz traffic returns to normal by September 30?",
      "eventTitle": "Strait of Hormuz traffic returns to normal by September 30?",
      "categoryId": "geopolitics-security",
      "category": "Geopolitics & Security",
      "probability": 0.0035,
      "probabilityPercent": 0.35,
      "probabilitySource": "bid-ask midpoint",
      "change24hPoints": -0.1,
      "change7dPoints": -0.75,
      "bestBid": 0.003,
      "bestAsk": 0.004,
      "spread": 0.001,
      "liquidity": 666353.87,
      "volume24h": 185461.1,
      "volumeTotal": 11233461.51,
      "openInterest": 2646245.29,
      "qualityScore": 96,
      "qualityGrade": "A",
      "qualityReasons": [
        "Liquidity $666,354",
        "24h volume $185,461",
        "Spread 0.10 points",
        "Resolution source supplied"
      ],
      "relevanceScore": 3,
      "assets": [
        "brent",
        "gold",
        "us-dollar",
        "wti"
      ],
      "resolutionSource": "https://portwatch.imf.org/pages/cb5856222a5b4105adc6ee7e880a1730",
      "description": "This market will resolve to “Yes” if IMF Portwatch publishes a 7-day moving average of transit calls (“Arrivals of Ships”) for the Strait of Hormuz equal to or above 60 for any date between market creation and September 30, 2026. Otherwise, this market will resolve to “No”.\n\nDaily transit calls include container, dry bulk, roll-on/roll-off, general cargo, and tanker ships. Ships not reported by IMF Portwatch will not be considered.\n\nThis market will resolve as soon as IMF Portwatch publishes a 7-day moving average of transit calls equal to or above the specified level, or once data has been published for the final date in the specified period and no such value has been published. If no data has been published for the final date of the specified period within 14 calendar days (ET) after the end of that period, this market will resolve based on data published up to that point.\n\nRevisions to previously published data points made within this market’s timeframe will be considered. However, they will not disqualify a previously published data point from qualifying. Revisions to previously published data points after data is published for September 30, 2026, however, will not be considered.\n\nIn case of obvious data integrity issues (i.e., erroneous data), the market may remain open until the end of the third calendar day (ET) after the date on which such data is first released to allow for corrections. Data integrity issues refer only to clerical or other similar errors in the underlying data, and do not include cases where IMF Portwatch differs from alternative sources.\n\nThe resolution source for this market will be IMF Portwatch, specifically the transit calls data published for the Strait of Hormuz at https://portwatch.imf.org/pages/cb5856222a5b4105adc6ee7e880a1730, both in",
      "endDate": "2026-10-01T03:59:00Z",
      "updatedAt": "2026-09-27T11:58:49.620609Z",
      "collectedAt": "2026-09-27T12:01:58Z",
      "sourceUrl": "https://polymarket.com/event/strait-of-hormuz-traffic-returns-to-normal-by-september-30-20260702154339440",
      "restricted": true,
      "acceptingOrders": true,
      "readOnly": true,
      "history": [
        {
          "date": "2026-07-15",
          "observedAt": "2026-07-15T19:36:45Z",
          "probability": 0.245
        },
        {
          "date": "2026-07-16",
          "observedAt": "2026-07-16T19:34:36Z",
          "probability": 0.235
        },
        {
          "date": "2026-07-17",
          "observedAt": "2026-07-17T19:32:47Z",
          "probability": 0.235
        },
        {
          "date": "2026-07-18",
          "observedAt": "2026-07-18T19:31:18Z",
          "probability": 0.195
        },
        {
          "date": "2026-07-19",
          "observedAt": "2026-07-19T19:32:01Z",
          "probability": 0.205
        },
        {
          "date": "2026-07-20",
          "observedAt": "2026-07-20T19:56:00Z",
          "probability": 0.235
        },
        {
          "date": "2026-07-21",
          "observedAt": "2026-07-21T19:50:59Z",
          "probability": 0.235
        },
        {
          "date": "2026-07-22",
          "observedAt": "2026-07-22T19:43:11Z",
          "probability": 0.225
        },
        {
          "date": "2026-07-23",
          "observedAt": "2026-07-23T19:45:52Z",
          "probability": 0.215
        },
        {
          "date": "2026-07-24",
          "observedAt": "2026-07-24T19:46:29Z",
          "probability": 0.215
        },
        {
          "date": "2026-07-25",
          "observedAt": "2026-07-25T19:34:31Z",
          "probability": 0.245
        },
        {
          "date": "2026-07-26",
          "observedAt": "2026-07-26T19:34:43Z",
          "probability": 0.27
        },
        {
          "date": "2026-07-27",
          "observedAt": "2026-07-27T19:53:49Z",
          "probability": 0.265
        },
        {
          "date": "2026-07-28",
          "observedAt": "2026-07-28T19:53:06Z",
          "probability": 0.255
        },
        {
          "date": "2026-07-29",
          "observedAt": "2026-07-29T19:42:52Z",
          "probability": 0.195
        },
        {
          "date": "2026-07-30",